{
  "source_id": "kexp",
  "identity": { "name": "KEXP Live Events Page", "owner_team": "ingestion", "contact_email": "dataops@example.com" },
  "enabled": true,
  "endpoints": [
    {
      "url": "https://www.kexp.org/events/kexp-events/",
      "method": "GET"
    }
  ],
  "auth": { "method": "none" },
  "rate_limits": { "requests_per_min": 30, "bytes_per_min": 50000000, "concurrency": 1 },
  "content": { "allowed_mime_types": ["text/html"], "max_payload_size_bytes": 50000000 },
  "policy": { "license_id": "terms-unknown", "robots_tos_posture": "respect", "pii_risk_class": "low", "pii_action": "allow" },
  "change_detection": { "strategy": "etag" },
  "parse_plan_ref": "parse_plan:kexp_html_v1"
}
